{
  "gate_id": "GATE_FX_0001",
  "schema_version": "agt002-phase01-gate/1.0.0",
  "type": "PHASE_AUDIT",
  "authority": {
    "principal": {
      "principal_id": "f1c70000-0000-0000-0000-000000000301",
      "principal_kind": "synthetic",
      "durable_ref": {
        "source": "fixture_registry",
        "locator": "fixture://principal/f1c70000-0000-0000-0000-000000000301",
        "verifiable": true
      },
      "display_label": "Fixture Gate Principal"
    },
    "grant_id": "GRANT-P1-0001",
    "delegation": null
  },
  "objective": "Verify the isolated fixture gate lifecycle happy path in OPEN status",
  "environment": "isolated_fixture",
  "synthetic": true,
  "scope": {
    "resource_kind": "fixture_resource",
    "resource_ids": ["f1c70000-0000-0000-0000-000000000201"],
    "actions": ["read"]
  },
  "preconditions": [
    {
      "precondition_id": "PRE-FX-0001",
      "statement": "Fixture precondition statement for gate-valid-open",
      "verdict": "VALID",
      "evidence_ids": ["EVID-FX-0001"]
    }
  ],
  "evidence": [
    {
      "evidence_id": "EVID-FX-0001",
      "kind": "fixture_record",
      "locator": "fixture://evidence/0001",
      "durable": true,
      "content_hash": "fixture-content-hash-0001",
      "captured_at_utc": "2026-09-20T00:00:00Z"
    }
  ],
  "expires_at_utc": "2026-09-24T00:00:00Z",
  "consumption_policy": {
    "max_consumptions": 1,
    "receipt_required": true,
    "idempotency_key": "idempotency-key-fx-0001"
  },
  "rollback": {
    "supported": false,
    "procedure": "Compensate via fixture rollback procedure",
    "locator": "fixture://rollback/0001"
  },
  "issued_at_utc": "2026-09-20T00:00:00Z",
  "status": "OPEN",
  "outcome": null,
  "consumption": null,
  "revocation": null,
  "artifact_set_hash": "9bdd60325867d11d0ea6876b8ef8d2b2f76ddde928f738aa8a6c5a8277f076a7",
  "active_case": null
}
