{
  "gate_id": "GATE_FX_0002",
  "schema_version": "agt002-phase01-gate/1.0.0",
  "type": "PHASE_AUDIT",
  "authority": {
    "principal": {
      "principal_id": "f1c70000-0000-0000-0000-000000000301",
      "principal_kind": "synthetic",
      "durable_ref": {
        "source": "fixture_registry",
        "locator": "fixture://principal/f1c70000-0000-0000-0000-000000000301",
        "verifiable": true
      },
      "display_label": "Fixture Gate Principal"
    },
    "grant_id": "GRANT-P1-0001",
    "delegation": null
  },
  "objective": "Verify the isolated fixture gate lifecycle happy path CONSUMED with PASS outcome",
  "environment": "isolated_fixture",
  "synthetic": true,
  "scope": {
    "resource_kind": "fixture_resource",
    "resource_ids": ["f1c70000-0000-0000-0000-000000000201"],
    "actions": ["read"]
  },
  "preconditions": [
    {
      "precondition_id": "PRE-FX-0002",
      "statement": "Fixture precondition statement for gate-valid-consumed-pass",
      "verdict": "VALID",
      "evidence_ids": ["EVID-FX-0002"]
    }
  ],
  "evidence": [
    {
      "evidence_id": "EVID-FX-0002",
      "kind": "fixture_record",
      "locator": "fixture://evidence/0002",
      "durable": true,
      "content_hash": "fixture-content-hash-0002",
      "captured_at_utc": "2026-09-20T00:00:00Z"
    }
  ],
  "expires_at_utc": "2026-09-24T00:00:00Z",
  "consumption_policy": {
    "max_consumptions": 1,
    "receipt_required": true,
    "idempotency_key": "idempotency-key-fx-0002"
  },
  "rollback": {
    "supported": false,
    "procedure": "Compensate via fixture rollback procedure",
    "locator": "fixture://rollback/0002"
  },
  "issued_at_utc": "2026-09-20T00:00:00Z",
  "status": "CONSUMED",
  "outcome": "PASS",
  "consumption": {
    "receipt_id": "RCPT-FX-0002",
    "consumed_at_utc": "2026-09-21T00:00:00Z",
    "consumed_by": "f1c70000-0000-0000-0000-000000000301"
  },
  "revocation": null,
  "artifact_set_hash": "c2f5ab4077bac3cfef6c34ca70e1b2692a044617313d1977485fa33bdf49b951",
  "active_case": null
}
